{
  "schema_version": "2.0.0",
  "id": "r4-c14",
  "rank": 4,
  "class_number": 14,
  "constant_id": 79,
  "scope": {
    "symmetrizer": "identity",
    "leading_permutation": "identity",
    "indecomposable": true
  },
  "index_base": 0,
  "datum": {
    "delays": [
      2,
      2,
      2,
      10
    ],
    "N_plus": [
      [
        [],
        [],
        [],
        []
      ],
      [
        [],
        [],
        [],
        []
      ],
      [
        [],
        [],
        [],
        [
          [
            1,
            1
          ]
        ]
      ],
      [
        [
          [
            1,
            3
          ],
          [
            1,
            7
          ]
        ],
        [
          [
            1,
            2
          ],
          [
            1,
            8
          ]
        ],
        [
          [
            1,
            1
          ],
          [
            1,
            9
          ]
        ],
        []
      ]
    ],
    "N_minus": [
      [
        [],
        [
          [
            1,
            1
          ]
        ],
        [],
        []
      ],
      [
        [
          [
            1,
            1
          ]
        ],
        [],
        [
          [
            1,
            1
          ]
        ],
        []
      ],
      [
        [],
        [
          [
            1,
            1
          ]
        ],
        [],
        []
      ],
      [
        [
          [
            1,
            5
          ]
        ],
        [],
        [],
        []
      ]
    ],
    "A_plus_1": [
      [
        2,
        0,
        0,
        0
      ],
      [
        0,
        2,
        0,
        0
      ],
      [
        0,
        0,
        2,
        -1
      ],
      [
        -2,
        -2,
        -2,
        2
      ]
    ],
    "A_minus_1": [
      [
        2,
        -1,
        0,
        0
      ],
      [
        -1,
        2,
        -1,
        0
      ],
      [
        0,
        -1,
        2,
        0
      ],
      [
        -1,
        0,
        0,
        2
      ]
    ]
  },
  "family": {
    "parameters": [
      "lambda",
      "s1",
      "s2",
      "s3"
    ],
    "fixed_shift": {
      "species": 3,
      "value": "0"
    },
    "dimension": 4,
    "rref": [
      [
        "1",
        "0",
        "0",
        "0",
        "0",
        "0",
        "0",
        "0",
        "0",
        "0",
        "0",
        "0",
        "0",
        "-1",
        "-1",
        "0"
      ],
      [
        "0",
        "1",
        "0",
        "0",
        "0",
        "0",
        "0",
        "0",
        "0",
        "0",
        "0",
        "0",
        "0",
        "-1",
        "-1",
        "0"
      ],
      [
        "0",
        "0",
        "1",
        "0",
        "0",
        "0",
        "0",
        "0",
        "0",
        "0",
        "0",
        "0",
        "0",
        "-1",
        "-1",
        "0"
      ],
      [
        "0",
        "0",
        "0",
        "1",
        "0",
        "0",
        "0",
        "0",
        "0",
        "0",
        "0",
        "0",
        "0",
        "-5",
        "-5",
        "0"
      ],
      [
        "0",
        "0",
        "0",
        "0",
        "1",
        "0",
        "0",
        "0",
        "0",
        "0",
        "0",
        "0",
        "-1",
        "-2",
        "-3",
        "1"
      ],
      [
        "0",
        "0",
        "0",
        "0",
        "0",
        "1",
        "0",
        "0",
        "0",
        "0",
        "0",
        "0",
        "0",
        "1",
        "1",
        "-1"
      ],
      [
        "0",
        "0",
        "0",
        "0",
        "0",
        "0",
        "1",
        "0",
        "0",
        "0",
        "0",
        "0",
        "0",
        "-1",
        "-1",
        "-1"
      ],
      [
        "0",
        "0",
        "0",
        "0",
        "0",
        "0",
        "0",
        "1",
        "0",
        "0",
        "0",
        "0",
        "1",
        "1",
        "1",
        "-1"
      ],
      [
        "0",
        "0",
        "0",
        "0",
        "0",
        "0",
        "0",
        "0",
        "1",
        "0",
        "0",
        "0",
        "1",
        "-2",
        "-2",
        "-1"
      ],
      [
        "0",
        "0",
        "0",
        "0",
        "0",
        "0",
        "0",
        "0",
        "0",
        "1",
        "0",
        "0",
        "1",
        "1",
        "2",
        "-1"
      ],
      [
        "0",
        "0",
        "0",
        "0",
        "0",
        "0",
        "0",
        "0",
        "0",
        "0",
        "1",
        "0",
        "1",
        "-3",
        "-2",
        "-1"
      ],
      [
        "0",
        "0",
        "0",
        "0",
        "0",
        "0",
        "0",
        "0",
        "0",
        "0",
        "0",
        "1",
        "1",
        "-1",
        "-1",
        "0"
      ]
    ],
    "variable_names": [
      "r0",
      "r1",
      "r2",
      "r3",
      "p0_23_0",
      "p0_30_0",
      "p0_30_1",
      "p0_31_0",
      "p0_31_1",
      "p0_32_0",
      "p0_32_1",
      "p1_01_0",
      "p1_10_0",
      "p1_12_0",
      "p1_21_0",
      "p1_30_0"
    ],
    "representative_values": [
      2,
      2,
      2,
      10,
      1,
      3,
      7,
      2,
      8,
      1,
      9,
      1,
      1,
      1,
      1,
      5
    ],
    "coverage": {
      "id": 79,
      "file": "0079_coverage.smt2",
      "result": "unsat",
      "encoding": "multiplicity",
      "arithmetic": "integer",
      "sha256": "61a6bed9fc5f7c63f504526383f690338ba1d760a88ca63c8c70b89ecd811d2d"
    }
  },
  "periodicity": {
    "time_coordinate": "displayed representative",
    "h_plus": 12,
    "h_minus": 10,
    "labelled_period": 22,
    "positive_negative_permutation": [
      0,
      1,
      2,
      3,
      4,
      5,
      6,
      7,
      8,
      9,
      10,
      11,
      12,
      13,
      14,
      15
    ],
    "negative_negative_permutation": [
      0,
      1,
      2,
      3,
      4,
      5,
      6,
      7,
      8,
      9,
      10,
      11,
      12,
      13,
      14,
      15
    ]
  },
  "exchange": {
    "vertices": [
      [
        0,
        0
      ],
      [
        0,
        1
      ],
      [
        1,
        0
      ],
      [
        1,
        1
      ],
      [
        2,
        0
      ],
      [
        2,
        1
      ],
      [
        3,
        0
      ],
      [
        3,
        1
      ],
      [
        3,
        2
      ],
      [
        3,
        3
      ],
      [
        3,
        4
      ],
      [
        3,
        5
      ],
      [
        3,
        6
      ],
      [
        3,
        7
      ],
      [
        3,
        8
      ],
      [
        3,
        9
      ]
    ],
    "B": [
      [
        0,
        0,
        0,
        -1,
        0,
        0,
        0,
        0,
        0,
        1,
        0,
        -1,
        0,
        1,
        0,
        0
      ],
      [
        0,
        0,
        1,
        0,
        0,
        0,
        0,
        0,
        -1,
        0,
        1,
        0,
        -1,
        0,
        0,
        0
      ],
      [
        0,
        -1,
        0,
        0,
        0,
        -1,
        0,
        0,
        1,
        0,
        0,
        0,
        0,
        0,
        1,
        0
      ],
      [
        1,
        0,
        0,
        0,
        1,
        0,
        0,
        -1,
        0,
        0,
        0,
        0,
        0,
        -1,
        0,
        0
      ],
      [
        0,
        0,
        0,
        -1,
        0,
        0,
        0,
        1,
        0,
        0,
        0,
        0,
        0,
        0,
        0,
        1
      ],
      [
        0,
        0,
        1,
        0,
        0,
        0,
        -1,
        0,
        0,
        0,
        0,
        0,
        0,
        0,
        -1,
        0
      ],
      [
        0,
        0,
        0,
        0,
        0,
        1,
        0,
        0,
        0,
        0,
        0,
        0,
        0,
        0,
        0,
        0
      ],
      [
        0,
        0,
        0,
        1,
        -1,
        0,
        0,
        0,
        0,
        0,
        0,
        0,
        0,
        0,
        0,
        0
      ],
      [
        0,
        1,
        -1,
        0,
        0,
        0,
        0,
        0,
        0,
        0,
        0,
        0,
        0,
        0,
        0,
        0
      ],
      [
        -1,
        0,
        0,
        0,
        0,
        0,
        0,
        0,
        0,
        0,
        0,
        1,
        0,
        0,
        0,
        0
      ],
      [
        0,
        -1,
        0,
        0,
        0,
        0,
        0,
        0,
        0,
        0,
        0,
        0,
        1,
        0,
        0,
        0
      ],
      [
        1,
        0,
        0,
        0,
        0,
        0,
        0,
        0,
        0,
        -1,
        0,
        0,
        0,
        0,
        0,
        0
      ],
      [
        0,
        1,
        0,
        0,
        0,
        0,
        0,
        0,
        0,
        0,
        -1,
        0,
        0,
        0,
        0,
        0
      ],
      [
        -1,
        0,
        0,
        1,
        0,
        0,
        0,
        0,
        0,
        0,
        0,
        0,
        0,
        0,
        0,
        0
      ],
      [
        0,
        0,
        -1,
        0,
        0,
        1,
        0,
        0,
        0,
        0,
        0,
        0,
        0,
        0,
        0,
        0
      ],
      [
        0,
        0,
        0,
        0,
        -1,
        0,
        0,
        0,
        0,
        0,
        0,
        0,
        0,